<?xml version="1.0" encoding="UTF-8"?>
<!DOCTYPE netTypeSpecification SYSTEM "netTypeSpecification.dtd">
<netTypeSpecification name="BlackTokenNet">
	<extendable class="de.huberlin.informatik.pnk.kernel.Net">
		<extension name="firingRule" class="de.huberlin.informatik.pnk.netElementExtensions.llNet.SimpleRule"/>
	</extendable>
	<extendable class="de.huberlin.informatik.pnk.kernel.Place">
		<extension name="marking" class="de.huberlin.informatik.pnk.netElementExtensions.llNet.BlackToken"/>
		<extension name="initialMarking" class="de.huberlin.informatik.pnk.netElementExtensions.llNet.BlackToken"/>
	</extendable>
	<extendable class="de.huberlin.informatik.pnk.kernel.Arc"> 
		<extension name="inscription" class="de.huberlin.informatik.pnk.netElementExtensions.llNet.BlackToken"/> 
	</extendable> 
	<extendable class="de.huberlin.informatik.pnk.kernel.Transition"> 
	</extendable> 
</netTypeSpecification>
